{
  "$schema": "https://json-schema.org/draft/2020-12/schema",
  "$id": "https://company-domain.invalid/contracts/partners/pharmacy/new-rx.schema.json",
  "title": "NewRx",
  "description": "A new prescription for a pharmacy (the NCPDP SCRIPT NewRx equivalent, as JSON), for one signed prescription. Built at send time by the e-prescribing adapter from the prescription the outbox names (backend/app/modules/medications, build_new_rx), sent to the simulated pharmacy for the demo (D97, D99) and, later, mapped to NCPDP SCRIPT by the e-prescribing vendor's adapter (Q12). Minimum necessary: no SSN (D27, D43), no address, no phone, no gender, no diagnosis, no insurance. Dates and decimal amounts as strings (D40). x-phi marks each field's sensitivity as the API contract does (EXTENSIONS.md).",
  "type": "object",
  "additionalProperties": false,
  "required": ["messageType", "schemaVersion", "correlationId", "createdAt", "signedAt", "prescriber", "patient", "pharmacy", "medication"],
  "properties": {
    "messageType": {
      "description": "Always `NewRx`.",
      "const": "NewRx",
      "x-phi": "none"
    },
    "schemaVersion": {
      "description": "This shape's version. A change that is not backward-compatible gets a new major version.",
      "const": "1.0",
      "x-phi": "none"
    },
    "correlationId": {
      "description": "Our prescription ID (NCPDP PrescriberOrderNumber). Every status reply echoes it and is filed against it. One NewRx per prescription, so the pharmacy drops a second message with the same `correlationId`.",
      "$ref": "#/$defs/Id",
      "x-phi": "internal-id"
    },
    "createdAt": {
      "description": "When the message was built (NCPDP Header SentTime), UTC.",
      "$ref": "#/$defs/Timestamp",
      "x-phi": "none"
    },
    "signedAt": {
      "description": "When the prescriber signed the prescription (NCPDP WrittenDate), UTC.",
      "$ref": "#/$defs/Timestamp",
      "x-phi": "none"
    },
    "prescriber": {
      "description": "Who signed it (NCPDP Prescriber).",
      "type": "object",
      "additionalProperties": false,
      "required": ["npi", "name"],
      "properties": {
        "npi": {
          "description": "The prescriber's National Provider Identifier, 10 digits.",
          "type": "string",
          "pattern": "^[0-9]{10}$",
          "maxLength": 10,
          "x-phi": "none"
        },
        "name": {
          "description": "The prescriber's name.",
          "$ref": "#/$defs/PersonName",
          "x-phi": "none"
        }
      },
      "x-phi": "none"
    },
    "patient": {
      "description": "Who the prescription is for (NCPDP Patient): enough for the pharmacy to match its own record, nothing more.",
      "type": "object",
      "additionalProperties": false,
      "required": ["name", "birthDate"],
      "properties": {
        "name": {
          "description": "The patient's legal name, never a preferred or previous one.",
          "$ref": "#/$defs/PersonName",
          "x-phi": "identifier"
        },
        "birthDate": {
          "description": "Date of birth.",
          "$ref": "#/$defs/Date",
          "x-phi": "identifier"
        }
      },
      "x-phi": "identifier"
    },
    "pharmacy": {
      "description": "Where it goes (NCPDP Pharmacy), from the platform's pharmacy directory.",
      "type": "object",
      "additionalProperties": false,
      "required": ["ncpdpId"],
      "properties": {
        "ncpdpId": {
          "description": "The pharmacy's NCPDP ID, 7 digits.",
          "type": "string",
          "pattern": "^[0-9]{7}$",
          "maxLength": 7,
          "x-phi": "none"
        },
        "npi": {
          "description": "The pharmacy's NPI, when the directory has it.",
          "type": "string",
          "pattern": "^[0-9]{10}$",
          "maxLength": 10,
          "x-phi": "none"
        }
      },
      "x-phi": "none"
    },
    "medication": {
      "description": "What to dispense and how it is taken (NCPDP MedicationPrescribed).",
      "type": "object",
      "additionalProperties": false,
      "required": ["description", "quantity", "refills", "substitutionAllowed", "sig"],
      "properties": {
        "rxnormCode": {
          "description": "The RxNorm RxCUI of the drug, from RxNorm Current Prescribable Content (NCPDP DrugCoded, qualifier SCD or SBD). Absent when the prescriber wrote the drug as text only.",
          "type": "string",
          "pattern": "^[0-9]{1,10}$",
          "maxLength": 10,
          "x-phi": "clinical"
        },
        "description": {
          "description": "The drug as words (NCPDP DrugDescription): the RxNorm name, otherwise the prescriber's text.",
          "type": "string",
          "minLength": 1,
          "maxLength": 500,
          "x-phi": "clinical"
        },
        "quantity": {
          "description": "How much to dispense (NCPDP Quantity).",
          "type": "object",
          "additionalProperties": false,
          "required": ["value", "unit"],
          "properties": {
            "value": {
              "description": "The amount, a decimal string greater than zero with at most three fraction digits (the API allows up to 100000).",
              "type": "string",
              "pattern": "^[0-9]{1,6}(\\.[0-9]{1,3})?$",
              "not": {"pattern": "^0+(\\.0+)?$"},
              "maxLength": 10,
              "x-phi": "clinical"
            },
            "unit": {
              "description": "The unit as the prescriber wrote it (`capsule`, `tablet`, `mL`); the vendor's adapter maps it to an NCPDP QuantityUnitOfMeasure code.",
              "type": "string",
              "minLength": 1,
              "maxLength": 32,
              "x-phi": "clinical"
            }
          },
          "x-phi": "clinical"
        },
        "daysSupply": {
          "description": "Days the quantity lasts (NCPDP DaysSupply). Absent when the prescriber left it out.",
          "type": "integer",
          "minimum": 1,
          "maximum": 365,
          "x-phi": "clinical"
        },
        "refills": {
          "description": "Refills allowed after the first fill (NCPDP NumberOfRefills); 0 when none were written.",
          "type": "integer",
          "minimum": 0,
          "maximum": 11,
          "x-phi": "clinical"
        },
        "substitutionAllowed": {
          "description": "Generic substitution allowed (NCPDP Substitutions: `0` when true, `1` (dispense as written) when false). True when the prescriber didn't say.",
          "type": "boolean",
          "x-phi": "clinical"
        },
        "sig": {
          "description": "The directions as written (NCPDP Sig, SigText).",
          "type": "string",
          "minLength": 1,
          "maxLength": 1000,
          "x-phi": "clinical"
        },
        "deaSchedule": {
          "description": "The DEA schedule of a controlled substance, from the RxNorm concept. Absent otherwise. Controlled substances need EPCS (Q19), which the demo doesn't do.",
          "type": "string",
          "enum": ["CII", "CIII", "CIV", "CV"],
          "x-phi": "clinical"
        },
        "noteToPharmacist": {
          "description": "The prescriber's note for the pharmacist (NCPDP Note, at most 210 characters).",
          "type": "string",
          "minLength": 1,
          "maxLength": 210,
          "x-phi": "clinical"
        }
      },
      "x-phi": "clinical"
    }
  },
  "$defs": {
    "Id": {
      "type": "string",
      "format": "uuid",
      "pattern": "^[0-9a-f]{8}-[0-9a-f]{4}-[0-9a-f]{4}-[0-9a-f]{4}-[0-9a-f]{12}$",
      "maxLength": 36
    },
    "Date": {
      "description": "A calendar date, YYYY-MM-DD.",
      "type": "string",
      "format": "date",
      "pattern": "^[0-9]{4}-[0-9]{2}-[0-9]{2}$",
      "maxLength": 10
    },
    "Timestamp": {
      "description": "An instant, RFC 3339, UTC with Z.",
      "type": "string",
      "format": "date-time",
      "pattern": "^[0-9]{4}-[0-9]{2}-[0-9]{2}T[0-9]{2}:[0-9]{2}:[0-9]{2}(\\.[0-9]{1,6})?Z$",
      "maxLength": 35
    },
    "PersonName": {
      "description": "A person's legal name (NCPDP LastName, FirstName, MiddleName).",
      "type": "object",
      "additionalProperties": false,
      "required": ["family"],
      "properties": {
        "family": {
          "type": "string",
          "minLength": 1,
          "maxLength": 100,
          "x-phi": "identifier"
        },
        "given": {
          "type": "array",
          "maxItems": 5,
          "items": {
            "type": "string",
            "minLength": 1,
            "maxLength": 100
          },
          "x-phi": "identifier"
        }
      }
    }
  }
}
